"Status","Start Time","Stop Time","Duration in ms","Parent Suite","Suite","Sub Suite","Test Class","Test Method","Name","Description"
"broken","Tue Jan 16 18:59:22 UTC 2024","Tue Jan 16 18:59:45 UTC 2024","23348","","Wallet - IDR Wallet - Withdraw","","","","User unsuccessfully withdraw Bank transfer/Ewallet/Internal Transfer when input amount above the maximum withdraw [MOBILE2-2204]",""
"broken","Tue Jan 16 18:54:13 UTC 2024","Tue Jan 16 18:54:20 UTC 2024","7854","","Wallet - IDR Wallet","","","","User successfully redirected to Deposit page when click Deposit [MOBILE2-2565]",""
"broken","Tue Jan 16 18:29:41 UTC 2024","Tue Jan 16 18:29:59 UTC 2024","17616","","Profile - Setup Withdrawal Account","","","","Unverified user successfully redirected to verify account page when click set up withdrawal account menu [MOBILE2-1130 MOBILE2-2114]",""
"passed","Tue Jan 16 19:10:04 UTC 2024","Tue Jan 16 19:10:10 UTC 2024","5912","","Wallet Home","","","","Users should be able to see empty state when have no assets for US Stock [MOBILE2-2548]",""
"passed","Tue Jan 16 18:28:01 UTC 2024","Tue Jan 16 18:28:04 UTC 2024","2791","","Profile","","","","User successfully redirected to set up withdrawal account page when click set up withdrawal account menu [MOBILE2-1049]",""
"passed","Tue Jan 16 18:57:45 UTC 2024","Tue Jan 16 18:58:01 UTC 2024","16539","","Wallet - IDR Wallet - Withdraw","","","","User unsuccessfully withdraw internal transfer with saving an address previously saved address [MOBILE2-2216]",""
"passed","Tue Jan 16 19:05:45 UTC 2024","Tue Jan 16 19:06:26 UTC 2024","41520","","Wallet Home","","","","Unverified user can not see asset summary section [MOBILE2-2630]",""
"broken","Tue Jan 16 18:58:58 UTC 2024","Tue Jan 16 18:59:22 UTC 2024","23457","","Wallet - IDR Wallet - Withdraw","","","","User unsuccessfully withdraw internal transfer/Bank transfer/Ewallet when input amount is under minimum [MOBILE2-2203]",""
"passed","Tue Jan 16 18:45:50 UTC 2024","Tue Jan 16 18:46:19 UTC 2024","29281","","Wallet - IDR Wallet - Deposit","","","","(Non-VIP MANDIRI) User successfully submit deposit 25mio to 49,999mio with BSS VA [MOBILE2-1770]",""
"broken","Tue Jan 16 18:30:38 UTC 2024","Tue Jan 16 18:31:43 UTC 2024","64107","","Profile - Setup Withdrawal Account","","","","User successfully save and delete account number [MOBILE2-1153 MOBILE2-1180]",""
"broken","Tue Jan 16 18:14:31 UTC 2024","Tue Jan 16 18:14:33 UTC 2024","1422","","Home","","","","User successfully redirected to referral page when click referral entrypoint on homecircle [MOBILE2-1534]",""
"passed","Tue Jan 16 18:22:34 UTC 2024","Tue Jan 16 18:22:38 UTC 2024","4351","","Profile - My Account","","","","User successfully redirected to live chat web view page when click live chat here link [MOBILE2-1137]",""
"passed","Tue Jan 16 18:42:42 UTC 2024","Tue Jan 16 18:42:59 UTC 2024","16821","","Wallet - IDR Wallet - Deposit","","","","(Non-VIP BCA) User successfully submit deposit ≥ 100mio with Virtual Account [MOBILE2-1767]",""
"passed","Tue Jan 16 18:44:41 UTC 2024","Tue Jan 16 18:45:50 UTC 2024","68460","","Wallet - IDR Wallet - Deposit","","","","(Non-VIP MANDIRI) User successfully submit deposit Rp10.000 to 24,999mio with Mandiri VA [MOBILE2-1771]",""
"passed","Tue Jan 16 18:38:26 UTC 2024","Tue Jan 16 18:39:28 UTC 2024","62267","","Wallet - Crypto Wallet - Send Coin","","","","User unsuccessfully send coin when input amount coin is under minimum [MOBILE2-2277]",""
"passed","Tue Jan 16 18:34:16 UTC 2024","Tue Jan 16 18:34:50 UTC 2024","33413","","Sign Up","","","","User can not sign up if it doesnt meet all validation password [MOBILE2-15]",""
"broken","Tue Jan 16 19:01:48 UTC 2024","Tue Jan 16 19:02:24 UTC 2024","36063","","Wallet - USD Wallet","","","","User should be able see balance breakdown USD [MOBILE2-2569]",""
"passed","Tue Jan 16 18:46:50 UTC 2024","Tue Jan 16 18:47:44 UTC 2024","54309","","Wallet - IDR Wallet - Deposit","","","","(VIP) User successfully submit deposit with virtual account except BCA/Mandiri [MOBILE2-1777]",""
"passed","Tue Jan 16 19:07:11 UTC 2024","Tue Jan 16 19:08:31 UTC 2024","79633","","Wallet Home","","","","User should be able to hide/unhide all numbers in the page when clicking on any eye icon [MOBILE2-2537]",""
"passed","Tue Jan 16 19:08:31 UTC 2024","Tue Jan 16 19:08:42 UTC 2024","10922","","Wallet Home","","","","User successfully redirected to portfolio page when click portfolio button [MOBILE2-2541]",""
"passed","Tue Jan 16 19:06:26 UTC 2024","Tue Jan 16 19:07:11 UTC 2024","44968","","Wallet Home","","","","User successfully access wallet page from Wallet Navigation Bar [MOBILE2-2532 MOBILE2-2539 MOBILE2-2540]",""
"passed","Tue Jan 16 18:08:23 UTC 2024","Tue Jan 16 18:08:39 UTC 2024","16206","","Home Non-login","","","","User can skip welcome screen [MOBILE2-1381]",""
"passed","Tue Jan 16 18:09:22 UTC 2024","Tue Jan 16 18:10:01 UTC 2024","38893","","Home","","","","User should see section favorite, market, and learning hub [MOBILE2-334 MOBILE2-343 MOBILE2-344]",""
"broken","Tue Jan 16 18:54:20 UTC 2024","Tue Jan 16 18:54:28 UTC 2024","7279","","Wallet - IDR Wallet","","","","User successfully redirected to Withdraw page when click Withdraw [MOBILE2-2566]",""
"passed","Tue Jan 16 18:28:11 UTC 2024","Tue Jan 16 18:28:14 UTC 2024","3024","","Profile","","","","User successfully redirected to referrals page when click referral program menu [MOBILE2-1131]",""
"passed","Tue Jan 16 18:24:08 UTC 2024","Tue Jan 16 18:24:25 UTC 2024","17850","","Profile - Phone Number","","","","User successfully add phone number use a number with another country code [MOBILE2-128]",""
"broken","Tue Jan 16 18:14:33 UTC 2024","Tue Jan 16 18:14:35 UTC 2024","2350","","Home","","","","User successfully redirected to live chat web view when click live chat entrypoint on homecircle [MOBILE2-1535]",""
"passed","Tue Jan 16 18:28:09 UTC 2024","Tue Jan 16 18:28:11 UTC 2024","2346","","Profile","","","","User successfully redirected to help center page when click help center menu [MOBILE2-1052]",""
"passed","Tue Jan 16 18:20:17 UTC 2024","Tue Jan 16 18:20:59 UTC 2024","42505","","Profile - Google Authenticator","","","","User successfully deactivated and activated google authenticator [MOBILE2-1186 MOBILE2-1187]",""
"passed","Tue Jan 16 18:19:19 UTC 2024","Tue Jan 16 18:19:27 UTC 2024","7854","","Profile - Change Password","","","","User cant change password if old password wrong [MOBILE2-1207]",""
"passed","Tue Jan 16 18:48:06 UTC 2024","Tue Jan 16 18:48:50 UTC 2024","43846","","Wallet - IDR Wallet - Deposit","","","","User cant deposit IDR when have phone number but unverified [MOBILE2-188]",""
"passed","Tue Jan 16 18:46:19 UTC 2024","Tue Jan 16 18:46:35 UTC 2024","16388","","Wallet - IDR Wallet - Deposit","","","","(Non-VIP MANDIRI) User successfully submit deposit ≥ 100mio with Virtual Account [MOBILE2-1773]",""
"passed","Tue Jan 16 18:40:50 UTC 2024","Tue Jan 16 18:41:39 UTC 2024","49481","","Wallet - IDR Wallet - Deposit","","","","(VIP-BCA) User successfully submit deposit with Virtual Account [MOBILE2-1765]",""
"passed","Tue Jan 16 18:35:33 UTC 2024","Tue Jan 16 18:36:19 UTC 2024","46825","","Wallet - Crypto Wallet - Receive Coin","","","","User successfully receive coins from Internal [MOBILE2-1621]",""
"broken","Tue Jan 16 18:18:07 UTC 2024","Tue Jan 16 18:18:25 UTC 2024","17542","","Profile - Change Password","","","","User successfully change and create new password [MOBILE2-2356]",""
"passed","Tue Jan 16 18:27:23 UTC 2024","Tue Jan 16 18:27:58 UTC 2024","35252","","Profile","","","","User should be able to see name and user ID on header [MOBILE2-1119]",""
"broken","Tue Jan 16 18:10:01 UTC 2024","Tue Jan 16 18:11:31 UTC 2024","90006","","Home","","","","Users successfully redirected to market page when click ""See All"" [MOBILE2-332 MOBILE2-1529]",""
"passed","Tue Jan 16 18:17:12 UTC 2024","Tue Jan 16 18:17:26 UTC 2024","14009","","Login","","","","User successfully redirected to sign up page when click Sign Up [MOBILE2-297]",""
"passed","Tue Jan 16 18:33:58 UTC 2024","Tue Jan 16 18:34:16 UTC 2024","17788","","Sign Up","","","","User can not sign up if email invalid [MOBILE2-16]",""
"passed","Tue Jan 16 18:24:51 UTC 2024","Tue Jan 16 18:25:06 UTC 2024","15703","","Profile - Phone Number","","","","User unsuccesfully add a phone number if phone number has been registered [MOBILE2-1751]",""
"passed","Tue Jan 16 18:56:48 UTC 2024","Tue Jan 16 18:57:34 UTC 2024","46140","","Wallet - IDR Wallet - Withdraw","","","","User can add new address to withdraw internal transfer [MOBILE2-2192]",""
"broken","Tue Jan 16 18:58:30 UTC 2024","Tue Jan 16 18:58:58 UTC 2024","27831","","Wallet - IDR Wallet - Withdraw","","","","User can add withdraw method E-Wallet on Withdraw Method page [MOBILE2-2103]",""
"passed","Tue Jan 16 18:39:28 UTC 2024","Tue Jan 16 18:39:49 UTC 2024","21245","","Wallet - Crypto Wallet - Send Coin","","","","User unsuccessfully send coin when input amount coin above the maximum quantity to send [MOBILE2-2281]",""
"passed","Tue Jan 16 18:59:45 UTC 2024","Tue Jan 16 18:59:53 UTC 2024","8464","","Wallet - IDR Wallet - Withdraw","","","","User unsuccessfully withdraw internal transfer/Bank transfer/Ewallet when input amount above available balance [MOBILE2-2205]",""
"broken","Tue Jan 16 18:32:40 UTC 2024","Tue Jan 16 18:33:08 UTC 2024","28091","","Profile - Setup Withdrawal Account","","","","User should not be able to add same e-wallet [MOBILE2-1168]",""
"broken","Tue Jan 16 18:47:44 UTC 2024","Tue Jan 16 18:48:06 UTC 2024","22384","","Wallet - IDR Wallet - Deposit","","","","User cant deposit IDR when doesnt have phone number and unverified [MOBILE2-190]",""
"passed","Tue Jan 16 18:29:59 UTC 2024","Tue Jan 16 18:30:38 UTC 2024","39852","","Profile - Setup Withdrawal Account","","","","User cant set wd account when havent add phone number and unverified [MOBILE2-2115]",""
"broken","Tue Jan 16 19:00:36 UTC 2024","Tue Jan 16 19:01:48 UTC 2024","71658","","Wallet - USD Wallet","","","","User should be able see total balance of USD owned [MOBILE2-2568]",""
"broken","Tue Jan 16 19:10:55 UTC 2024","Tue Jan 16 19:11:24 UTC 2024","28528","","Wallet Home","","","","User should be able to see Owned asset for US Stock when click US Stock tab [MOBILE2-2546]",""
"passed","Tue Jan 16 18:15:32 UTC 2024","Tue Jan 16 18:15:49 UTC 2024","17335","","Forgot Password","","","","User should be able to see the suspend page if they submit a forgot password to an e-mail that is being suspended [MOBILE2-1652]",""
"passed","Tue Jan 16 18:57:34 UTC 2024","Tue Jan 16 18:57:40 UTC 2024","5868","","Wallet - IDR Wallet - Withdraw","","","","User cant submit withdraw internal transfer when input invalid address [MOBILE2-2195]",""
"passed","Tue Jan 16 18:54:05 UTC 2024","Tue Jan 16 18:54:13 UTC 2024","7240","","Wallet - IDR Wallet","","","","User should be able see balance breakdown IDR [MOBILE2-2552]",""
"passed","Tue Jan 16 19:08:42 UTC 2024","Tue Jan 16 19:09:23 UTC 2024","40992","","Wallet Home","","","","User should be able to see IDR, USD, Crypto, US Stocks card on the Wallet Card Carousel section [MOBILE2-2542 MOBILE2-2543 MOBILE2-2544 MOBILE2-2545]",""
"passed","Tue Jan 16 18:28:04 UTC 2024","Tue Jan 16 18:28:07 UTC 2024","2885","","Profile","","","","User successfully redirected to security page when click security menu [MOBILE2-1050]",""
"passed","Tue Jan 16 18:16:28 UTC 2024","Tue Jan 16 18:16:55 UTC 2024","26249","","Login","","","","User successfully sign in using 2FA [MOBILE2-283]",""
"passed","Tue Jan 16 18:57:40 UTC 2024","Tue Jan 16 18:57:45 UTC 2024","4566","","Wallet - IDR Wallet - Withdraw","","","","User cant submit withdraw internal transfer when input own address [MOBILE2-2196]",""
"broken","Tue Jan 16 19:02:24 UTC 2024","Tue Jan 16 19:03:00 UTC 2024","35849","","Wallet - USD Wallet","","","","User successfully redirected to Buy page when click Buy [MOBILE2-2572]",""
"passed","Tue Jan 16 18:21:57 UTC 2024","Tue Jan 16 18:22:34 UTC 2024","36570","","Profile - My Account","","","","User can see detail information account (Verified Account) [MOBILE2-1054]",""
"broken","Tue Jan 16 18:13:01 UTC 2024","Tue Jan 16 18:14:31 UTC 2024","90006","","Home","","","","User successfully redirected to rekuiz page when click rekuiz entrypoint on homecircle [MOBILE2-1533]",""
"broken","Tue Jan 16 18:55:51 UTC 2024","Tue Jan 16 18:56:09 UTC 2024","17622","","Wallet - IDR Wallet - Withdraw","","","","User cant withdraw IDR when doesnt have phone number and unverified [MOBILE2-2091]",""
"passed","Tue Jan 16 18:16:55 UTC 2024","Tue Jan 16 18:17:12 UTC 2024","17375","","Login","","","","User successfully sign in using email and password (non-2FA) [MOBILE2-1380 MOBILE2-279]",""
"passed","Tue Jan 16 18:49:37 UTC 2024","Tue Jan 16 18:49:48 UTC 2024","11102","","Wallet - IDR Wallet - Deposit","","","","User cant deposit by E-Wallet (OVO) with under minimum amount [MOBILE2-234]",""
"passed","Tue Jan 16 19:05:30 UTC 2024","Tue Jan 16 19:05:45 UTC 2024","14610","","Wallet Home","","","","User unsuccessfully access wallet page before login and can not see asset summary section [MOBILE2-2533 MOBILE2-2831]",""
"passed","Tue Jan 16 18:23:20 UTC 2024","Tue Jan 16 18:24:08 UTC 2024","47956","","Profile - Phone Number","","","","User succesfully add and delete a phone number [MOBILE2-129 MOBILE2-1172 MOBILE2-2353]",""
"passed","Tue Jan 16 18:24:25 UTC 2024","Tue Jan 16 18:24:51 UTC 2024","25252","","Profile - Phone Number","","","","User successfully add phone number using old phone number [MOBILE2-130]",""
"broken","Tue Jan 16 19:03:00 UTC 2024","Tue Jan 16 19:03:36 UTC 2024","36324","","Wallet - USD Wallet","","","","User successfully redirected to Sell page when click Sell [MOBILE2-2573]",""
"passed","Tue Jan 16 18:28:07 UTC 2024","Tue Jan 16 18:28:09 UTC 2024","2140","","Profile","","","","User successfully redirected to live chat web view page when click live chat menu [MOBILE2-1051]",""
"passed","Tue Jan 16 18:41:39 UTC 2024","Tue Jan 16 18:42:42 UTC 2024","62478","","Wallet - IDR Wallet - Deposit","","","","(Non-VIP BCA) User successfully submit deposit Rp10.000 to 49,999mio with BSS VA [MOBILE2-1707]",""
"passed","Tue Jan 16 18:42:59 UTC 2024","Tue Jan 16 18:44:09 UTC 2024","69823","","Wallet - IDR Wallet - Deposit","","","","(VIP-MANDIRI) User successfully submit deposit Rp10.000 to 24,999mio with Mandiri VA [MOBILE2-1769]",""
"passed","Tue Jan 16 18:25:49 UTC 2024","Tue Jan 16 18:26:41 UTC 2024","52407","","Profile - PIN","","","","User can setup PIN for security at reku account [MOBILE2-1211]",""
"broken","Tue Jan 16 18:32:11 UTC 2024","Tue Jan 16 18:32:40 UTC 2024","28589","","Profile - Setup Withdrawal Account","","","","User successfully save and delete e-wallet number [MOBILE2-1164 MOBILE2-1179]",""
"broken","Tue Jan 16 19:03:36 UTC 2024","Tue Jan 16 19:04:47 UTC 2024","70715","","Wallet - USD Wallet","","","","User should be able see empty state on USD Card page when no transaction state [MOBILE2-2574]",""
"broken","Tue Jan 16 18:31:43 UTC 2024","Tue Jan 16 18:32:11 UTC 2024","28675","","Profile - Setup Withdrawal Account","","","","User should not be able to add same bank and account number [MOBILE2-1157]",""
"passed","Tue Jan 16 18:54:28 UTC 2024","Tue Jan 16 18:55:10 UTC 2024","42657","","Wallet - IDR Wallet","","","","User should be able see empty state on IDR Card page when no transaction state [MOBILE2-2567]",""
"passed","Tue Jan 16 18:48:50 UTC 2024","Tue Jan 16 18:49:37 UTC 2024","47079","","Wallet - IDR Wallet - Deposit","","","","User successfully see IDR Deposit Address and QR Code for Internal Transfer [MOBILE2-224]",""
"passed","Tue Jan 16 18:28:14 UTC 2024","Tue Jan 16 18:29:00 UTC 2024","45747","","Profile","","","","User successfully logout from application when click log out button [MOBILE2-1127 MOBILE2-1281]",""
"passed","Tue Jan 16 18:18:25 UTC 2024","Tue Jan 16 18:19:19 UTC 2024","54466","","Profile - Change Password","","","","User cant change password if it doesnt meet all validation password [MOBILE2-1198]",""
"passed","Tue Jan 16 18:15:17 UTC 2024","Tue Jan 16 18:15:32 UTC 2024","15162","","Forgot Password","","","","User successfully submit forget/reset password [MOBILE2-310]",""
"passed","Tue Jan 16 19:09:23 UTC 2024","Tue Jan 16 19:10:04 UTC 2024","40970","","Wallet Home","","","","Users should be able to see empty state when have no assets for Crypto [MOBILE2-2534]",""
"passed","Tue Jan 16 18:33:48 UTC 2024","Tue Jan 16 18:33:58 UTC 2024","10421","","Sign Up","","","","User can click sign up [MOBILE2-1379]",""
"passed","Tue Jan 16 18:39:49 UTC 2024","Tue Jan 16 18:40:09 UTC 2024","19122","","Wallet - Crypto Wallet - Send Coin","","","","User unsuccessfully send coin when input amount coin above the available coin balance [MOBILE2-2282]",""
"passed","Tue Jan 16 18:44:09 UTC 2024","Tue Jan 16 18:44:41 UTC 2024","32746","","Wallet - IDR Wallet - Deposit","","","","(VIP-MANDIRI) User successfully submit deposit 25mio to 99,999mio / ≥ 100 mio with Virtual Account [MOBILE2-1712]",""
"passed","Tue Jan 16 19:10:10 UTC 2024","Tue Jan 16 19:10:55 UTC 2024","45607","","Wallet Home","","","","User should be able to see Owned asset for Crypto when click Crypto tab [MOBILE2-2547]",""
"passed","Tue Jan 16 18:50:39 UTC 2024","Tue Jan 16 18:51:29 UTC 2024","49998","","Wallet - IDR Wallet - Deposit","","","","User cant deposit IDR by Virtual Account with under minimum amount [MOBILE2-235]",""
"passed","Tue Jan 16 18:19:27 UTC 2024","Tue Jan 16 18:19:37 UTC 2024","10525","","Profile - Change Password","","","","User successfully change and create new password (using 2FA) [MOBILE2-2357]",""
"passed","Tue Jan 16 18:56:09 UTC 2024","Tue Jan 16 18:56:48 UTC 2024","39671","","Wallet - IDR Wallet - Withdraw","","","","User cant withdraw IDR when have phone number but unverified [MOBILE2-2092]",""
"passed","Tue Jan 16 18:49:48 UTC 2024","Tue Jan 16 18:50:39 UTC 2024","50473","","Wallet - IDR Wallet - Deposit","","","","User cant deposit IDR by bank transfer with under minimum amount [MOBILE2-233]",""
"broken","Tue Jan 16 18:11:31 UTC 2024","Tue Jan 16 18:13:01 UTC 2024","90003","","Home","","","","User successfully redirected to staking page when click staking entrypoint on homecircle [MOBILE2-1532]",""
"broken","Tue Jan 16 18:21:39 UTC 2024","Tue Jan 16 18:21:57 UTC 2024","17575","","Profile - My Account","","","","Unverified user successfully redirected to verify account page when click verify now buttton [MOBILE2-1135]",""
"passed","Tue Jan 16 18:27:58 UTC 2024","Tue Jan 16 18:28:01 UTC 2024","2680","","Profile","","","","User successfully redirected to mission page when click mission menu [MOBILE2-1672]",""
"broken","Tue Jan 16 18:38:03 UTC 2024","Tue Jan 16 18:38:26 UTC 2024","23033","","Wallet - Crypto Wallet - Send Coin","","","","User cant send coin when doesnt have phone number and unverified [MOBILE2-2227]",""
"broken","Tue Jan 16 18:53:03 UTC 2024","Tue Jan 16 18:54:05 UTC 2024","62482","","Wallet - IDR Wallet","","","","User should be able see total balance IDR owned [MOBILE2-2551]",""
"passed","Tue Jan 16 18:37:16 UTC 2024","Tue Jan 16 18:38:03 UTC 2024","47346","","Wallet - Crypto Wallet - Send Coin","","","","User cant send coin when have phone number but unverified [MOBILE2-2226]",""
"passed","Tue Jan 16 18:51:29 UTC 2024","Tue Jan 16 18:52:22 UTC 2024","53121","","Wallet - IDR Wallet - Deposit","","","","User cant deposit by E-Wallet (DANA) with above the maximum deposit limit [MOBILE2-242]",""
"passed","Tue Jan 16 18:36:19 UTC 2024","Tue Jan 16 18:36:37 UTC 2024","17172","","Wallet - Crypto Wallet - Receive Coin","","","","User successfully receive coins from external [MOBILE2-1622]",""
"broken","Tue Jan 16 18:58:01 UTC 2024","Tue Jan 16 18:58:30 UTC 2024","28911","","Wallet - IDR Wallet - Withdraw","","","","User can add withdraw method Transfer Bank on Withdraw Method page [MOBILE2-2102]",""
"passed","Tue Jan 16 18:46:35 UTC 2024","Tue Jan 16 18:46:50 UTC 2024","14241","","Wallet - IDR Wallet - Deposit","","","","(Non-VIP) User successfully submit deposit with virtual account except BCA/Mandiri [MOBILE2-1774]",""
